Abbreviations,OR(95%CI),P-value(Bonferroni),P-star,Metabolite
LA%,"1.132 [1.110,1.155]",1.374e-29,***,Linoleic Acid to Total-Fatty Acids percentage
PUFA/MUFA,"1.108 [1.087,1.130]",2.856e-19,***,Polyunsaturated Fatty Acids to Monounsaturated Fatty Acids ratio
Omega-6%,"1.108 [1.087,1.130]",3.940e-20,***,Omega-6 Fatty Acids to Total-Fatty Acids percentage
PUFA%,"1.107 [1.086,1.129]",1.648e-19,***,Polyunsaturated Fatty Acids to Total-Fatty Acids percentage
S-LDL-PL%,"1.095 [1.073,1.117]",1.486e-13,***,Phospholipids to Total-Lipids in Small LDL percentage
XL-HDL-FC,"1.077 [1.052,1.104]",3.262e-04,***,Free Cholesterol in Very Large HDL
IDL-PL%,"1.074 [1.054,1.095]",1.225e-07,***,Phospholipids to Total-Lipids in IDL percentage
Citrate,"1.073 [1.051,1.094]",1.188e-06,***,Citrate
Gln,"1.059 [1.038,1.079]",0.002,**,Glutamine
Acetate,"1.058 [1.038,1.078]",6.426e-04,***,Acetate
M-HDL-PL%,"1.058 [1.037,1.079]",0.007,**,Phospholipids to Total-Lipids in Medium HDL percentage
Phe,"1.053 [1.033,1.074]",0.043,*,Phenylalanine
S-LDL-C,"0.950 [0.931,0.968]",0.047,*,Cholesterol in Small LDL
Remnant-C,"0.950 [0.931,0.968]",0.032,*,"Remnant Cholesterol (Non-HDL, Non-LDL -Cholesterol)"
Acetone,"0.950 [0.931,0.968]",0.041,*,Acetone
M-LDL-CE%,"0.949 [0.930,0.967]",0.030,*,Cholesteryl Esters to Total-Lipids in Medium LDL percentage
LDL-FC,"0.947 [0.929,0.966]",0.011,*,Free Cholesterol in LDL
IDL-PL,"0.947 [0.928,0.966]",0.031,*,Phospholipids in IDL
M-LDL-TG,"0.946 [0.928,0.965]",0.005,**,Triglycerides in Medium LDL
XL-HDL-CE%,"0.946 [0.930,0.963]",1.360e-04,***,Cholesteryl Esters to Total-Lipids in Very Large HDL percentage
M-LDL-FC,"0.946 [0.928,0.965]",0.006,**,Free Cholesterol in Medium LDL
IDL-FC,"0.946 [0.927,0.965]",0.014,*,Free Cholesterol in IDL
Omega-6,"0.946 [0.928,0.964]",0.003,**,Omega-6 Fatty Acids
Non-HDL-C,"0.946 [0.928,0.964]",0.002,**,Total-Cholesterol Minus HDL-C
Clinical LDL-C,"0.945 [0.928,0.964]",0.002,**,Clinical LDL Cholesterol
S-LDL-CE,"0.944 [0.926,0.963]",0.002,**,Cholesteryl Esters in Small LDL
L-LDL-FC,"0.943 [0.925,0.962]",0.002,**,Free Cholesterol in Large LDL
S-HDL-TG,"0.942 [0.923,0.962]",0.004,**,Triglycerides in Small HDL
PUFA,"0.942 [0.924,0.960]",3.178e-04,***,Polyunsaturated Fatty Acids
LDL-C,"0.942 [0.924,0.960]",1.695e-04,***,LDL Cholesterol
IDL-C,"0.942 [0.923,0.961]",6.709e-04,***,Cholesterol in IDL
IDL-TG,"0.942 [0.923,0.961]",9.328e-04,***,Triglycerides in IDL
L-LDL-C,"0.941 [0.923,0.960]",1.614e-04,***,Cholesterol in Large LDL
IDL-L,"0.941 [0.923,0.960]",2.950e-04,***,Total-Lipids in IDL
LDL-PL,"0.941 [0.923,0.959]",1.592e-04,***,Phospholipids in LDL
LDL-L,"0.941 [0.923,0.959]",6.730e-05,***,Total-Lipids in LDL
LDL-TG,"0.940 [0.922,0.959]",1.751e-04,***,Triglycerides in LDL
HDL-TG,"0.940 [0.921,0.959]",3.685e-04,***,Triglycerides in HDL
L-LDL-CE,"0.940 [0.922,0.958]",6.853e-05,***,Cholesteryl Esters in Large LDL
IDL-CE,"0.940 [0.921,0.959]",2.122e-04,***,Cholesteryl Esters in IDL
LDL-CE,"0.939 [0.922,0.958]",3.497e-05,***,Cholesteryl Esters in LDL
M-LDL-PL,"0.939 [0.921,0.958]",7.084e-05,***,Phospholipids in Medium LDL
L-LDL-L,"0.939 [0.921,0.957]",1.954e-05,***,Total-Lipids in Large LDL
M-LDL-C,"0.938 [0.920,0.956]",1.638e-05,***,Cholesterol in Medium LDL
M-LDL-L,"0.938 [0.920,0.956]",1.529e-05,***,Total-Lipids in Medium LDL
S-LDL-C%,"0.937 [0.919,0.955]",4.218e-06,***,Cholesterol to Total-Lipids in Small LDL percentage
M-LDL-CE,"0.935 [0.917,0.954]",3.074e-06,***,Cholesteryl Esters in Medium LDL
L-LDL-PL,"0.935 [0.917,0.953]",3.389e-06,***,Phospholipids in Large LDL
L-LDL-TG,"0.934 [0.916,0.953]",3.718e-06,***,Triglycerides in Large LDL
L-HDL-L,"0.932 [0.909,0.955]",0.006,**,Total-Lipids in Large HDL
L-HDL-P,"0.928 [0.904,0.954]",0.016,*,Concentration of Large HDL Particles
Total-FC,"0.928 [0.910,0.946]",1.097e-08,***,Total-Free Cholesterol
M-HDL-TG,"0.926 [0.907,0.945]",3.311e-08,***,Triglycerides in Medium HDL
GlycA,"0.924 [0.906,0.943]",3.896e-09,***,Glycoprotein Acetyls
SFA%,"0.921 [0.904,0.938]",1.724e-13,***,Saturated Fatty Acids to Total-Fatty Acids percentage
3-Hydroxybutyrate,"0.921 [0.901,0.941]",4.456e-08,***,3-Hydroxybutyrate
L-HDL-PL,"0.920 [0.897,0.943]",1.694e-05,***,Phospholipids in Large HDL
Total-C,"0.919 [0.902,0.937]",1.294e-12,***,Total-Cholesterol
M-HDL-FC%,"0.919 [0.901,0.938]",5.375e-11,***,Free Cholesterol to Total-Lipids in Medium HDL percentage
Total-CE,"0.915 [0.897,0.933]",2.619e-14,***,Total-Esterified Cholesterol
Total-L,"0.914 [0.897,0.932]",2.281e-15,***,Total-Lipids in Lipoprotein Particles
MUFA%,"0.914 [0.896,0.932]",1.181e-13,***,Monounsaturated Fatty Acids to Total-Fatty Acids percentage
Total-FA,"0.913 [0.896,0.930]",3.439e-16,***,Total-Fatty Acids
S-LDL-CE%,"0.912 [0.895,0.930]",4.062e-15,***,Cholesteryl Esters to Total-Lipids in Small LDL percentage
MUFA,"0.905 [0.888,0.923]",3.458e-19,***,Monounsaturated Fatty Acids
SFA,"0.904 [0.888,0.922]",1.990e-20,***,Saturated Fatty Acids
Total-PL,"0.886 [0.868,0.903]",1.501e-28,***,Total-Phospholipids in Lipoprotein Particles
SM,"0.883 [0.865,0.901]",4.421e-27,***,Sphingomyelins
Cholines,"0.878 [0.861,0.896]",2.361e-31,***,Total-Cholines
PC,"0.877 [0.859,0.895]",3.257e-31,***,Phosphatidylcholines
Phosphoglyc,"0.874 [0.857,0.892]",2.913e-34,***,Phosphoglycerides
HDL-FC,"0.866 [0.845,0.887]",8.325e-26,***,Free Cholesterol in HDL
HDL-C,"0.862 [0.842,0.882]",1.294e-30,***,HDL Cholesterol
HDL-CE,"0.861 [0.841,0.881]",4.815e-31,***,Cholesteryl Esters in HDL
HDL-L,"0.857 [0.838,0.876]",1.007e-36,***,Total-Lipids in HDL
HDL-PL,"0.854 [0.836,0.874]",2.113e-38,***,Phospholipids in HDL
S-HDL-FC,"0.851 [0.834,0.868]",4.493e-50,***,Free Cholesterol in Small HDL
M-HDL-L,"0.844 [0.826,0.862]",2.463e-49,***,Total-Lipids in Medium HDL
M-HDL-PL,"0.844 [0.826,0.862]",4.056e-49,***,Phospholipids in Medium HDL
ApoA1,"0.842 [0.824,0.861]",8.119e-48,***,Apolipoprotein A1
M-HDL-C,"0.842 [0.823,0.861]",7.438e-47,***,Cholesterol in Medium HDL
S-HDL-CE,"0.842 [0.825,0.859]",1.354e-58,***,Cholesteryl Esters in Small HDL
M-HDL-CE,"0.841 [0.823,0.860]",3.177e-47,***,Cholesteryl Esters in Medium HDL
M-HDL-FC,"0.841 [0.822,0.861]",1.916e-43,***,Free Cholesterol in Medium HDL
S-HDL-C,"0.841 [0.824,0.857]",2.893e-60,***,Cholesterol in Small HDL
S-HDL-P,"0.838 [0.821,0.855]",1.285e-60,***,Concentration of Small HDL Particles
S-HDL-L,"0.835 [0.819,0.852]",6.310e-65,***,Total-Lipids in Small HDL
M-HDL-P,"0.834 [0.816,0.854]",4.360e-49,***,Concentration of Medium HDL Particles
Total-P,"0.834 [0.816,0.852]",1.214e-56,***,Total-Concentration of Lipoprotein Particles
S-HDL-PL,"0.832 [0.815,0.849]",5.528e-66,***,Phospholipids in Small HDL
HDL-P,"0.829 [0.812,0.848]",1.908e-58,***,Concentration of HDL Particles
