Abbreviations,OR(95%CI),P-value(Bonferroni),P-star,Metabolite
Total-FC,"1.079 [1.057,1.101]",3.228e-08,***,Total-Free Cholesterol
Non-HDL-C,"1.078 [1.057,1.100]",2.151e-08,***,Total-Cholesterol Minus HDL-C
Total-C,"1.078 [1.056,1.100]",2.251e-07,***,Total-Cholesterol
Clinical LDL-C,"1.077 [1.055,1.098]",6.392e-08,***,Clinical LDL Cholesterol
Remnant-C,"1.076 [1.055,1.098]",4.681e-08,***,"Remnant Cholesterol (Non-HDL, Non-LDL -Cholesterol)"
M-VLDL-C,"1.076 [1.056,1.097]",9.380e-09,***,Cholesterol in Medium VLDL
Total-CE,"1.076 [1.054,1.098]",7.376e-07,***,Total-Esterified Cholesterol
ApoB,"1.075 [1.055,1.096]",3.322e-08,***,Apolipoprotein B
LDL-C,"1.075 [1.054,1.097]",9.510e-08,***,LDL Cholesterol
M-VLDL-CE,"1.075 [1.054,1.096]",4.405e-08,***,Cholesteryl Esters in Medium VLDL
LDL-CE,"1.075 [1.054,1.096]",9.972e-08,***,Cholesteryl Esters in LDL
LDL-L,"1.075 [1.054,1.096]",1.490e-07,***,Total-Lipids in LDL
L-LDL-C,"1.074 [1.053,1.096]",2.049e-07,***,Cholesterol in Large LDL
S-LDL-CE,"1.074 [1.054,1.095]",9.229e-08,***,Cholesteryl Esters in Small LDL
L-LDL-L,"1.074 [1.053,1.095]",3.197e-07,***,Total-Lipids in Large LDL
L-LDL-P,"1.074 [1.053,1.094]",4.750e-08,***,Concentration of Large LDL Particles
S-LDL-L,"1.073 [1.053,1.094]",1.236e-07,***,Total-Lipids in Small LDL
L-LDL-CE,"1.073 [1.053,1.095]",2.642e-07,***,Cholesteryl Esters in Large LDL
S-LDL-C,"1.073 [1.053,1.094]",1.085e-07,***,Cholesterol in Small LDL
LDL-P,"1.073 [1.053,1.094]",8.036e-08,***,Concentration of LDL Particles
M-VLDL-FC,"1.073 [1.053,1.093]",5.952e-08,***,Free Cholesterol in Medium VLDL
Total-L,"1.073 [1.051,1.095]",2.416e-06,***,Total-Lipids in Lipoprotein Particles
LDL-PL,"1.072 [1.052,1.093]",2.525e-07,***,Phospholipids in LDL
L-LDL-FC,"1.072 [1.051,1.093]",7.051e-07,***,Free Cholesterol in Large LDL
LDL-FC,"1.072 [1.051,1.093]",7.608e-07,***,Free Cholesterol in LDL
M-LDL-C,"1.072 [1.051,1.092]",4.984e-07,***,Cholesterol in Medium LDL
M-VLDL-PL,"1.072 [1.051,1.092]",2.341e-07,***,Phospholipids in Medium VLDL
L-LDL-PL,"1.072 [1.051,1.092]",5.680e-07,***,Phospholipids in Large LDL
IDL-L,"1.071 [1.050,1.093]",5.273e-06,***,Total-Lipids in IDL
M-LDL-L,"1.071 [1.051,1.092]",7.422e-07,***,Total-Lipids in Medium LDL
M-LDL-CE,"1.071 [1.050,1.092]",8.592e-07,***,Cholesteryl Esters in Medium LDL
IDL-PL,"1.071 [1.050,1.092]",2.716e-06,***,Phospholipids in IDL
IDL-C,"1.070 [1.049,1.092]",8.616e-06,***,Cholesterol in IDL
S-LDL-PL,"1.070 [1.050,1.091]",8.262e-07,***,Phospholipids in Small LDL
VLDL-CE,"1.070 [1.050,1.090]",7.297e-07,***,Cholesteryl Esters in VLDL
M-VLDL-P,"1.070 [1.050,1.090]",7.193e-07,***,Concentration of Medium VLDL Particles
S-VLDL-FC,"1.070 [1.050,1.090]",6.206e-07,***,Free Cholesterol in Small VLDL
VLDL-C,"1.069 [1.049,1.090]",1.357e-06,***,VLDL Cholesterol
IDL-CE,"1.069 [1.048,1.091]",1.086e-05,***,Cholesteryl Esters in IDL
M-LDL-PL,"1.069 [1.049,1.089]",1.705e-06,***,Phospholipids in Medium LDL
S-LDL-P,"1.069 [1.048,1.089]",2.009e-06,***,Concentration of Small LDL Particles
M-VLDL-L,"1.068 [1.048,1.089]",4.939e-06,***,Total-Lipids in Medium VLDL
M-LDL-FC,"1.068 [1.048,1.088]",3.568e-06,***,Free Cholesterol in Medium LDL
IDL-FC,"1.067 [1.046,1.089]",2.808e-05,***,Free Cholesterol in IDL
M-LDL-P,"1.067 [1.047,1.088]",8.305e-06,***,Concentration of Medium LDL Particles
LA,"1.066 [1.045,1.087]",8.100e-05,***,Linoleic Acid
S-VLDL-PL,"1.065 [1.046,1.086]",1.112e-05,***,Phospholipids in Small VLDL
Omega-6,"1.065 [1.044,1.087]",1.381e-04,***,Omega-6 Fatty Acids
S-VLDL-C,"1.065 [1.045,1.085]",1.096e-05,***,Cholesterol in Small VLDL
VLDL-FC,"1.065 [1.045,1.086]",3.344e-05,***,Free Cholesterol in VLDL
S-LDL-FC,"1.065 [1.045,1.085]",1.957e-05,***,Free Cholesterol in Small LDL
IDL-P,"1.065 [1.045,1.085]",1.431e-05,***,Concentration of IDL Particles
PUFA,"1.065 [1.043,1.086]",2.794e-04,***,Polyunsaturated Fatty Acids
Total-PL,"1.064 [1.042,1.086]",9.268e-04,***,Total-Phospholipids in Lipoprotein Particles
XS-VLDL-CE,"1.062 [1.042,1.083]",2.785e-04,***,Cholesteryl Esters in Very Small VLDL
XS-VLDL-C,"1.061 [1.041,1.082]",3.563e-04,***,Cholesterol in Very Small VLDL
S-VLDL-CE,"1.061 [1.041,1.081]",1.228e-04,***,Cholesteryl Esters in Small VLDL
VLDL-PL,"1.061 [1.041,1.082]",5.764e-04,***,Phospholipids in VLDL
L-VLDL-CE,"1.060 [1.041,1.081]",2.979e-04,***,Cholesteryl Esters in Large VLDL
L-LDL-C%,"1.060 [1.037,1.084]",0.039,*,Cholesterol to Total-Lipids in Large LDL percentage
SM,"1.060 [1.039,1.082]",0.005,**,Sphingomyelins
VLDL-P,"1.059 [1.039,1.080]",6.790e-04,***,Concentration of VLDL Particles
Total-FA,"1.059 [1.038,1.081]",0.008,**,Total-Fatty Acids
XL-VLDL-CE,"1.058 [1.038,1.079]",0.002,**,Cholesteryl Esters in Very Large VLDL
VLDL-L,"1.058 [1.037,1.079]",0.006,**,Total-Lipids in VLDL
XS-VLDL-FC,"1.057 [1.037,1.077]",0.003,**,Free Cholesterol in Very Small VLDL
L-VLDL-C,"1.056 [1.036,1.077]",0.007,**,Cholesterol in Large VLDL
S-VLDL-L,"1.056 [1.036,1.076]",0.005,**,Total-Lipids in Small VLDL
ApoB/ApoA1,"1.055 [1.035,1.076]",0.016,*,Apolipoprotein B to Apolipoprotein A1 ratio
XS-VLDL-L,"1.055 [1.035,1.075]",0.010,*,Total-Lipids in Very Small VLDL
XL-VLDL-C,"1.055 [1.034,1.076]",0.025,*,Cholesterol in Very Large VLDL
XS-VLDL-P,"1.054 [1.034,1.074]",0.014,*,Concentration of Very Small VLDL Particles
M-LDL-FC%,"0.997 [0.976,1.019]",1.000,,Free Cholesterol to Total-Lipids in Medium LDL percentage
M-HDL-CE%,"0.994 [0.973,1.016]",1.000,,Cholesteryl Esters to Total-Lipids in Medium HDL percentage
M-HDL-PL%,"0.987 [0.965,1.009]",1.000,,Phospholipids to Total-Lipids in Medium HDL percentage
Gln,"0.982 [0.964,1.001]",1.000,,Glutamine
Phe,"0.965 [0.947,0.984]",1.000,,Phenylalanine
