Abbreviations,HR(95%CI),P-value(Bonferroni),P-star,Metabolite
IDL-PL%,1.19 [1.13-1.25],3.230e-06,***,Phospholipids to Total-Lipids in IDL percentage
L-LDL-TG%,1.18 [1.13-1.24],9.830e-07,***,Triglycerides to Total-Lipids in Large LDL percentage
XS-VLDL-PL%,1.18 [1.13-1.24],1.134e-05,***,Phospholipids to Total-Lipids in Very Small VLDL percentage
M-LDL-TG%,1.17 [1.12-1.23],1.362e-05,***,Triglycerides to Total-Lipids in Medium LDL percentage
IDL-TG%,1.17 [1.11-1.23],6.701e-05,***,Triglycerides to Total-Lipids in IDL percentage
S-LDL-PL%,1.16 [1.10-1.22],0.007,**,Phospholipids to Total-Lipids in Small LDL percentage
M-LDL-CE%,0.87 [0.83-0.92],0.034,*,Cholesteryl Esters to Total-Lipids in Medium LDL percentage
M-HDL-FC%,0.87 [0.83-0.91],0.022,*,Free Cholesterol to Total-Lipids in Medium HDL percentage
Total-FA,0.87 [0.83-0.91],0.002,**,Total-Fatty Acids
L-VLDL-CE,0.87 [0.82-0.91],0.034,*,Cholesteryl Esters in Large VLDL
XS-VLDL-CE,0.86 [0.82-0.91],0.028,*,Cholesteryl Esters in Very Small VLDL
S-HDL-L,0.86 [0.82-0.91],0.002,**,Total-Lipids in Small HDL
XL-VLDL-CE,0.86 [0.81-0.91],0.007,**,Cholesteryl Esters in Very Large VLDL
VLDL-FC,0.86 [0.82-0.90],0.002,**,Free Cholesterol in VLDL
S-VLDL-C,0.86 [0.81-0.90],0.003,**,Cholesterol in Small VLDL
HDL-P,0.86 [0.81-0.91],0.014,*,Concentration of HDL Particles
L-LDL-CE%,0.85 [0.81-0.90],4.265e-05,***,Cholesteryl Esters to Total-Lipids in Large LDL percentage
S-LDL-CE%,0.85 [0.81-0.90],1.283e-04,***,Cholesteryl Esters to Total-Lipids in Small LDL percentage
IDL-C%,0.85 [0.82-0.89],3.350e-07,***,Cholesterol to Total-Lipids in IDL percentage
S-VLDL-PL,0.85 [0.81-0.90],7.549e-04,***,Phospholipids in Small VLDL
S-HDL-FC,0.85 [0.81-0.90],2.711e-04,***,Free Cholesterol in Small HDL
VLDL-C,0.85 [0.81-0.89],1.182e-04,***,VLDL Cholesterol
Phosphoglyc,0.85 [0.81-0.89],1.393e-04,***,Phosphoglycerides
M-LDL-C%,0.85 [0.81-0.89],1.856e-07,***,Cholesterol to Total-Lipids in Medium LDL percentage
VLDL-CE,0.85 [0.81-0.89],8.297e-05,***,Cholesteryl Esters in VLDL
SM,0.84 [0.80-0.89],1.361e-04,***,Sphingomyelins
PC,0.84 [0.80-0.89],3.261e-05,***,Phosphatidylcholines
S-VLDL-FC,0.84 [0.80-0.89],2.818e-05,***,Free Cholesterol in Small VLDL
M-VLDL-L,0.84 [0.80-0.88],8.180e-06,***,Total-Lipids in Medium VLDL
S-HDL-CE,0.84 [0.80-0.88],6.863e-06,***,Cholesteryl Esters in Small HDL
Cholines,0.84 [0.80-0.88],5.814e-06,***,Total-Cholines
S-HDL-C,0.84 [0.80-0.88],3.563e-06,***,Cholesterol in Small HDL
M-VLDL-CE,0.84 [0.79-0.88],4.058e-06,***,Cholesteryl Esters in Medium VLDL
Total-P,0.84 [0.79-0.88],5.649e-05,***,Total-Concentration of Lipoprotein Particles
M-VLDL-PL,0.84 [0.79-0.88],3.676e-06,***,Phospholipids in Medium VLDL
M-VLDL-P,0.84 [0.79-0.88],6.061e-06,***,Concentration of Medium VLDL Particles
IDL-PL,0.83 [0.79-0.88],3.211e-06,***,Phospholipids in IDL
Total-PL,0.83 [0.79-0.87],1.916e-07,***,Total-Phospholipids in Lipoprotein Particles
S-HDL-P,0.83 [0.79-0.88],1.184e-06,***,Concentration of Small HDL Particles
S-LDL-C%,0.83 [0.79-0.87],1.143e-09,***,Cholesterol to Total-Lipids in Small LDL percentage
M-VLDL-FC,0.83 [0.79-0.88],1.476e-06,***,Free Cholesterol in Medium VLDL
IDL-FC,0.83 [0.79-0.88],8.713e-07,***,Free Cholesterol in IDL
L-LDL-C%,0.83 [0.79-0.87],2.738e-10,***,Cholesterol to Total-Lipids in Large LDL percentage
S-LDL-P,0.83 [0.79-0.88],8.026e-07,***,Concentration of Small LDL Particles
L-LDL-P,0.83 [0.79-0.88],1.147e-06,***,Concentration of Large LDL Particles
S-LDL-PL,0.83 [0.79-0.87],2.588e-07,***,Phospholipids in Small LDL
M-VLDL-C,0.83 [0.79-0.87],5.009e-07,***,Cholesterol in Medium VLDL
IDL-CE%,0.83 [0.79-0.87],4.435e-11,***,Cholesteryl Esters to Total-Lipids in IDL percentage
ApoB,0.83 [0.79-0.87],3.812e-08,***,Apolipoprotein B
Remnant-C,0.83 [0.79-0.87],8.792e-09,***,"Remnant Cholesterol (Non-HDL, Non-LDL -Cholesterol)"
Omega-6,0.83 [0.79-0.87],1.502e-08,***,Omega-6 Fatty Acids
M-LDL-P,0.83 [0.78-0.87],1.574e-07,***,Concentration of Medium LDL Particles
LDL-P,0.83 [0.78-0.87],1.634e-07,***,Concentration of LDL Particles
IDL-P,0.83 [0.78-0.87],4.219e-07,***,Concentration of IDL Particles
IDL-L,0.83 [0.79-0.87],1.528e-08,***,Total-Lipids in IDL
LA,0.82 [0.79-0.87],3.510e-09,***,Linoleic Acid
Total-L,0.82 [0.79-0.87],7.575e-10,***,Total-Lipids in Lipoprotein Particles
PUFA,0.82 [0.78-0.86],2.471e-09,***,Polyunsaturated Fatty Acids
S-LDL-FC,0.82 [0.78-0.86],4.424e-09,***,Free Cholesterol in Small LDL
S-LDL-L,0.82 [0.78-0.86],1.505e-09,***,Total-Lipids in Small LDL
IDL-C,0.82 [0.78-0.86],8.741e-10,***,Cholesterol in IDL
Non-HDL-C,0.82 [0.78-0.86],1.939e-11,***,Total-Cholesterol Minus HDL-C
Total-FC,0.81 [0.77-0.86],9.240e-11,***,Total-Free Cholesterol
S-LDL-CE,0.81 [0.77-0.85],4.570e-10,***,Cholesteryl Esters in Small LDL
Total-C,0.81 [0.77-0.85],4.818e-12,***,Total-Cholesterol
L-LDL-L,0.81 [0.77-0.85],1.485e-11,***,Total-Lipids in Large LDL
Clinical LDL-C,0.81 [0.77-0.85],1.748e-12,***,Clinical LDL Cholesterol
LDL-L,0.81 [0.77-0.85],5.469e-12,***,Total-Lipids in LDL
IDL-CE,0.81 [0.77-0.85],1.619e-10,***,Cholesteryl Esters in IDL
Total-CE,0.81 [0.77-0.85],3.992e-12,***,Total-Esterified Cholesterol
M-LDL-L,0.81 [0.77-0.85],3.337e-11,***,Total-Lipids in Medium LDL
M-LDL-CE,0.81 [0.77-0.85],8.000e-11,***,Cholesteryl Esters in Medium LDL
S-LDL-C,0.81 [0.77-0.85],1.071e-10,***,Cholesterol in Small LDL
LDL-PL,0.81 [0.77-0.85],2.107e-11,***,Phospholipids in LDL
LDL-CE,0.81 [0.77-0.85],3.396e-12,***,Cholesteryl Esters in LDL
L-LDL-CE,0.81 [0.77-0.85],1.176e-11,***,Cholesteryl Esters in Large LDL
M-LDL-PL,0.81 [0.77-0.85],9.553e-11,***,Phospholipids in Medium LDL
L-LDL-C,0.81 [0.77-0.85],4.699e-12,***,Cholesterol in Large LDL
LDL-C,0.81 [0.77-0.85],1.334e-12,***,LDL Cholesterol
L-LDL-PL,0.81 [0.77-0.85],2.734e-11,***,Phospholipids in Large LDL
LDL-FC,0.81 [0.77-0.85],1.222e-11,***,Free Cholesterol in LDL
M-LDL-C,0.81 [0.77-0.85],1.091e-11,***,Cholesterol in Medium LDL
M-LDL-FC,0.81 [0.77-0.85],2.787e-11,***,Free Cholesterol in Medium LDL
L-LDL-FC,0.80 [0.76-0.85],1.946e-11,***,Free Cholesterol in Large LDL
