Abbreviations,HR(95%CI),P-value(Bonferroni),P-star,Metabolite
Creatinine,1.79 [1.67-1.93],6.087e-49,***,Creatinine
XS-VLDL-PL%,1.50 [1.38-1.63],1.955e-15,***,Phospholipids to Total-Lipids in Very Small VLDL percentage
GlycA,1.49 [1.37-1.62],6.685e-15,***,Glycoprotein Acetyls
IDL-TG%,1.39 [1.28-1.50],1.326e-10,***,Triglycerides to Total-Lipids in IDL percentage
L-LDL-TG%,1.38 [1.27-1.49],8.317e-10,***,Triglycerides to Total-Lipids in Large LDL percentage
IDL-PL%,1.34 [1.24-1.46],3.917e-07,***,Phospholipids to Total-Lipids in IDL percentage
M-LDL-TG%,1.34 [1.24-1.44],5.902e-08,***,Triglycerides to Total-Lipids in Medium LDL percentage
XS-VLDL-TG%,1.31 [1.20-1.42],7.805e-05,***,Triglycerides to Total-Lipids in Very Small VLDL percentage
M-HDL-PL%,1.26 [1.16-1.37],0.022,*,Phospholipids to Total-Lipids in Medium HDL percentage
S-LDL-TG%,1.24 [1.15-1.35],0.030,*,Triglycerides to Total-Lipids in Small LDL percentage
Albumin,0.81 [0.75-0.87],0.026,*,Albumin
Remnant-C,0.80 [0.74-0.87],0.016,*,"Remnant Cholesterol (Non-HDL, Non-LDL -Cholesterol)"
M-LDL-C,0.80 [0.74-0.87],0.023,*,Cholesterol in Medium LDL
S-HDL-P,0.79 [0.73-0.87],0.049,*,Concentration of Small HDL Particles
Total-L,0.79 [0.73-0.85],0.001,**,Total-Lipids in Lipoprotein Particles
S-HDL-CE,0.79 [0.72-0.86],0.011,*,Cholesteryl Esters in Small HDL
S-LDL-FC,0.79 [0.72-0.85],0.002,**,Free Cholesterol in Small LDL
Non-HDL-C,0.78 [0.73-0.85],3.812e-04,***,Total-Cholesterol Minus HDL-C
LDL-L,0.78 [0.72-0.85],4.749e-04,***,Total-Lipids in LDL
S-HDL-C,0.78 [0.72-0.85],0.006,**,Cholesterol in Small HDL
LDL-CE,0.78 [0.72-0.85],7.817e-04,***,Cholesteryl Esters in LDL
LDL-PL,0.78 [0.72-0.85],6.664e-04,***,Phospholipids in LDL
S-VLDL-FC%,0.78 [0.72-0.84],1.033e-04,***,Free Cholesterol to Total-Lipids in Small VLDL percentage
IDL-P,0.78 [0.72-0.85],9.970e-04,***,Concentration of IDL Particles
IDL-PL,0.78 [0.71-0.84],6.878e-04,***,Phospholipids in IDL
S-VLDL-PL%,0.77 [0.71-0.84],1.683e-04,***,Phospholipids to Total-Lipids in Small VLDL percentage
LDL-C,0.77 [0.71-0.84],7.160e-05,***,LDL Cholesterol
M-HDL-P,0.77 [0.70-0.85],0.018,*,Concentration of Medium HDL Particles
M-LDL-C%,0.77 [0.72-0.83],7.502e-08,***,Cholesterol to Total-Lipids in Medium LDL percentage
HDL-PL,0.77 [0.70-0.85],0.014,*,Phospholipids in HDL
L-LDL-FC%,0.77 [0.72-0.83],1.402e-06,***,Free Cholesterol to Total-Lipids in Large LDL percentage
L-LDL-CE,0.77 [0.71-0.83],1.008e-04,***,Cholesteryl Esters in Large LDL
L-LDL-L,0.77 [0.71-0.83],4.433e-05,***,Total-Lipids in Large LDL
Phosphoglyc,0.77 [0.71-0.84],4.327e-04,***,Phosphoglycerides
M-LDL-FC,0.77 [0.71-0.83],1.625e-04,***,Free Cholesterol in Medium LDL
M-HDL-CE,0.77 [0.70-0.84],0.004,**,Cholesteryl Esters in Medium HDL
Clinical LDL-C,0.77 [0.71-0.83],4.429e-06,***,Clinical LDL Cholesterol
SM,0.77 [0.70-0.83],5.377e-04,***,Sphingomyelins
Total-FC,0.76 [0.70-0.83],1.589e-05,***,Total-Free Cholesterol
M-HDL-C,0.76 [0.70-0.84],0.002,**,Cholesterol in Medium HDL
L-LDL-C,0.76 [0.70-0.82],9.673e-06,***,Cholesterol in Large LDL
L-LDL-PL,0.76 [0.70-0.82],1.732e-05,***,Phospholipids in Large LDL
Total-PL,0.76 [0.70-0.82],2.065e-05,***,Total-Phospholipids in Lipoprotein Particles
XS-VLDL-C%,0.75 [0.70-0.81],2.872e-08,***,Cholesterol to Total-Lipids in Very Small VLDL percentage
IDL-L,0.75 [0.70-0.82],1.961e-06,***,Total-Lipids in IDL
M-HDL-FC,0.75 [0.68-0.83],0.002,**,Free Cholesterol in Medium HDL
ApoA1,0.75 [0.69-0.82],4.210e-04,***,Apolipoprotein A1
IDL-FC,0.75 [0.69-0.82],6.006e-06,***,Free Cholesterol in IDL
Cholines,0.75 [0.69-0.82],1.143e-05,***,Total-Cholines
PC,0.75 [0.69-0.82],1.515e-05,***,Phosphatidylcholines
LDL-FC,0.75 [0.69-0.81],1.618e-06,***,Free Cholesterol in LDL
L-HDL-C,0.75 [0.67-0.83],0.018,*,Cholesterol in Large HDL
HDL-L,0.75 [0.68-0.82],4.149e-04,***,Total-Lipids in HDL
L-HDL-CE,0.75 [0.67-0.83],0.018,*,Cholesteryl Esters in Large HDL
S-LDL-C%,0.74 [0.69-0.80],7.629e-10,***,Cholesterol to Total-Lipids in Small LDL percentage
Total-C,0.74 [0.68-0.80],3.585e-08,***,Total-Cholesterol
XS-VLDL-CE%,0.74 [0.69-0.80],3.702e-10,***,Cholesteryl Esters to Total-Lipids in Very Small VLDL percentage
HDL-P,0.74 [0.67-0.81],1.999e-05,***,Concentration of HDL Particles
L-LDL-FC,0.74 [0.68-0.80],2.120e-07,***,Free Cholesterol in Large LDL
L-LDL-C%,0.73 [0.68-0.79],1.875e-10,***,Cholesterol to Total-Lipids in Large LDL percentage
IDL-C,0.73 [0.68-0.79],1.508e-08,***,Cholesterol in IDL
Total-CE,0.73 [0.68-0.79],5.999e-09,***,Total-Esterified Cholesterol
M-HDL-FC%,0.73 [0.67-0.79],5.419e-08,***,Free Cholesterol to Total-Lipids in Medium HDL percentage
IDL-CE,0.73 [0.67-0.79],4.390e-09,***,Cholesteryl Esters in IDL
IDL-C%,0.73 [0.68-0.78],7.313e-14,***,Cholesterol to Total-Lipids in IDL percentage
Total-P,0.72 [0.66-0.79],8.184e-07,***,Total-Concentration of Lipoprotein Particles
HDL-FC,0.72 [0.65-0.80],5.556e-05,***,Free Cholesterol in HDL
HDL-CE,0.72 [0.65-0.79],4.790e-06,***,Cholesteryl Esters in HDL
HDL-C,0.71 [0.65-0.79],3.763e-06,***,HDL Cholesterol
IDL-CE%,0.70 [0.65-0.75],7.478e-17,***,Cholesteryl Esters to Total-Lipids in IDL percentage
